source,subreddit_or_ticker,post_id,created_utc,created_datetime,title,text,score_or_likes,num_comments,url,permalink,stocktwits_sentiment_label,combined_text,clean_text,lda_text,token_count
stocktwits,TSLA,654507504,1779895500.0,2026-05-27T15:25:00Z,,$TSLA wounded bird same play,,,https://stocktwits.com/syril/message/654507504,https://stocktwits.com/syril/message/654507504,,nan $TSLA wounded bird same play,nan TSLA wounded bird same play,nan tsla wounded bird same play,6
stocktwits,TSLA,654507176,1779895386.0,2026-05-27T15:23:06Z,,"$WMT 
Bro we’re looking at $2000+ a share. Bears played to much. $TSLA 
They’re like that one kid at the park who didn’t bring a basketball to play but insist on ball hogging even when they’re down by “30 points” $SPY 
That starting five would be Buffet, Burry, Fink, Dimon, and Griffin",,,https://stocktwits.com/PivotalSaints/message/654507176,https://stocktwits.com/PivotalSaints/message/654507176,Bullish,"nan $WMT 
Bro we’re looking at $2000+ a share. Bears played to much. $TSLA 
They’re like that one kid at the park who didn’t bring a basketball to play but insist on ball hogging even when they’re down by “30 points” $SPY 
That starting five would be Buffet, Burry, Fink, Dimon, and Griffin","nan WMT Bro we re looking at 2000 a share. Bears played to much. TSLA They re like that one kid at the park who didn t bring a basketball to play but insist on ball hogging even when they re down by 30 points SPY That starting five would be Buffet, Burry, Fink, Dimon, and Griffin",nan wmt bro looking share bears played much tsla one kid park didn bring basketball play insist ball hogging even down points spy starting five buffet burry fink dimon griffin,30
stocktwits,TSLA,654506344,1779895089.0,2026-05-27T15:18:09Z,,"$TSLA sitting right on a key LTF pivot. 
 
445 is the line in the sand. Bulls need a clean reclaim with volume, not a weak pop and fade. If 445 holds and gets accepted, it opens a path toward 485 and potentially a new expansion leg. 
 
If rejection repeats, then probability shifts back into a pullback to build a higher low on 4H structure before any real trend continuation. 
 
Right now it’s simple: breakout attempt vs rejection test. Market is deciding, not confirming. 
 
745 is the broader momentum trigger. Above it, bulls stay in control. Below it, expect chop and rotation. 
 
How are you positioning this, breakout chase or waiting for the higher low? 
 
Follow me    👉@ChipDistribution7 for real-time updates and everything. Let’s make moves!",,,https://stocktwits.com/ChipDistribution7/message/654506344,https://stocktwits.com/ChipDistribution7/message/654506344,,"nan $TSLA sitting right on a key LTF pivot. 
 
445 is the line in the sand. Bulls need a clean reclaim with volume, not a weak pop and fade. If 445 holds and gets accepted, it opens a path toward 485 and potentially a new expansion leg. 
 
If rejection repeats, then probability shifts back into a pullback to build a higher low on 4H structure before any real trend continuation. 
 
Right now it’s simple: breakout attempt vs rejection test. Market is deciding, not confirming. 
 
745 is the broader momentum trigger. Above it, bulls stay in control. Below it, expect chop and rotation. 
 
How are you positioning this, breakout chase or waiting for the higher low? 
 
Follow me    👉@ChipDistribution7 for real-time updates and everything. Let’s make moves!","nan TSLA sitting right on a key LTF pivot. 445 is the line in the sand. Bulls need a clean reclaim with volume, not a weak pop and fade. If 445 holds and gets accepted, it opens a path toward 485 and potentially a new expansion leg. If rejection repeats, then probability shifts back into a pullback to build a higher low on 4H structure before any real trend continuation. Right now it s simple breakout attempt vs rejection test. Market is deciding, not confirming. 745 is the broader momentum trigger. Above it, bulls stay in control. Below it, expect chop and rotation. How are you positioning this, breakout chase or waiting for the higher low? Follow me ChipDistribution7 for real-time updates and everything. Let s make moves!",nan tsla sitting right key ltf pivot line sand bulls need clean reclaim volume weak pop fade holds gets accepted opens path toward potentially new expansion leg rejection repeats probability shifts back pullback build higher low structure before any real trend continuation right simple breakout attempt rejection test market deciding confirming broader momentum trigger above bulls stay control below expect chop rotation how positioning breakout chase waiting higher low follow chipdistribution real time updates everything let make moves,78
stocktwits,TSLA,654506075,1779894998.0,2026-05-27T15:16:38Z,,"$TSLA Basically, the market might do what you think it&#39;s going to, but because of options, it&#39;s going to do it in the most retarded and unexpeted way. Has to kill all the premiums first.",,,https://stocktwits.com/Sweaty_Druid/message/654506075,https://stocktwits.com/Sweaty_Druid/message/654506075,,"nan $TSLA Basically, the market might do what you think it&#39;s going to, but because of options, it&#39;s going to do it in the most retarded and unexpeted way. Has to kill all the premiums first.","nan TSLA Basically, the market might do what you think it 39 s going to, but because of options, it 39 s going to do it in the most retarded and unexpeted way. Has to kill all the premiums first.",nan tsla basically market might think going because options going most retarded unexpeted way kill premiums first,17
stocktwits,TSLA,654505899,1779894946.0,2026-05-27T15:15:46Z,,$TSLA bull trap there. Rejected,,,https://stocktwits.com/Grkgy88/message/654505899,https://stocktwits.com/Grkgy88/message/654505899,,nan $TSLA bull trap there. Rejected,nan TSLA bull trap there. Rejected,nan tsla bull trap rejected,5
stocktwits,TSLA,654505883,1779894942.0,2026-05-27T15:15:42Z,,$TSLA put out that spacehoax ipo already i wanna buy puts on this pos,,,https://stocktwits.com/everevolving09/message/654505883,https://stocktwits.com/everevolving09/message/654505883,,nan $TSLA put out that spacehoax ipo already i wanna buy puts on this pos,nan TSLA put out that spacehoax ipo already i wanna buy puts on this pos,nan tsla put spacehoax ipo already wanna buy puts pos,10
stocktwits,TSLA,654505486,1779894817.0,2026-05-27T15:13:37Z,,$TSLA Lol Will produce amplified pure energy directly from the sun ;),,,https://stocktwits.com/bushka/message/654505486,https://stocktwits.com/bushka/message/654505486,Bullish,nan $TSLA Lol Will produce amplified pure energy directly from the sun ;),nan TSLA Lol Will produce amplified pure energy directly from the sun,nan tsla lol produce amplified pure energy directly sun,9
stocktwits,TSLA,654505381,1779894778.0,2026-05-27T15:12:58Z,,$TSLA let’s see if 442.5 rejects,,1.0,https://stocktwits.com/Grkgy88/message/654505381,https://stocktwits.com/Grkgy88/message/654505381,,nan $TSLA let’s see if 442.5 rejects,nan TSLA let s see if 442.5 rejects,nan tsla let see rejects,5
stocktwits,TSLA,654505127,1779894704.0,2026-05-27T15:11:44Z,,"$TSLA  
 
Currently up 12% on these lovely longs.  
 
ATHs incoming... if the Daily Order Flow remains Bullish.",,1.0,https://stocktwits.com/DWldn/message/654505127,https://stocktwits.com/DWldn/message/654505127,Bullish,"nan $TSLA  
 
Currently up 12% on these lovely longs.  
 
ATHs incoming... if the Daily Order Flow remains Bullish.",nan TSLA Currently up 12 on these lovely longs. ATHs incoming... if the Daily Order Flow remains Bullish.,nan tsla currently lovely longs aths incoming daily order flow remains bullish,12
stocktwits,TSLA,654505112,1779894699.0,2026-05-27T15:11:39Z,,"$MCOM $SPY $TSLA 
HahahahahahahahahahahamawahahwhHhahahaha 😈 $GRPS",,,https://stocktwits.com/PivotalSaints/message/654505112,https://stocktwits.com/PivotalSaints/message/654505112,Bullish,"nan $MCOM $SPY $TSLA 
HahahahahahahahahahahamawahahwhHhahahaha 😈 $GRPS",nan MCOM SPY TSLA HahahahahahahahahahahamawahahwhHhahahaha GRPS,nan mcom spy tsla hahahahahahahahahahahamawahahwhhhahahaha grps,6
stocktwits,TSLA,654505095,1779894694.0,2026-05-27T15:11:34Z,,$TSLA I have been saying all time high before years end.  Thinking more likely all time high in next 2 months.  July.,,,https://stocktwits.com/WhatTheActualFRK/message/654505095,https://stocktwits.com/WhatTheActualFRK/message/654505095,,nan $TSLA I have been saying all time high before years end.  Thinking more likely all time high in next 2 months.  July.,nan TSLA I have been saying all time high before years end. Thinking more likely all time high in next 2 months. July.,nan tsla saying time high before years end thinking likely time high next months july,15
stocktwits,TSLA,654505060,1779894685.0,2026-05-27T15:11:25Z,,$NIO Rode up $INTC from 18. Nio is the next trade. Holding shares &amp; calls. Oil is going up to stay up high for years. Massive catalyst for all EV companies &amp; the chips/batteries needed to make them. $TSLA $NVDA,,,https://stocktwits.com/AbraKrak/message/654505060,https://stocktwits.com/AbraKrak/message/654505060,,nan $NIO Rode up $INTC from 18. Nio is the next trade. Holding shares &amp; calls. Oil is going up to stay up high for years. Massive catalyst for all EV companies &amp; the chips/batteries needed to make them. $TSLA $NVDA,nan NIO Rode up INTC from 18. Nio is the next trade. Holding shares amp calls. Oil is going up to stay up high for years. Massive catalyst for all EV companies amp the chips batteries needed to make them. TSLA NVDA,nan nio rode intc nio next trade holding shares amp calls oil going stay high years massive catalyst companies amp chips batteries needed make tsla nvda,26
stocktwits,TSLA,654504814,1779894616.0,2026-05-27T15:10:16Z,,$TSLA sweep buyers exhausted. Either going lower or range bound. Still watching,,,https://stocktwits.com/Grkgy88/message/654504814,https://stocktwits.com/Grkgy88/message/654504814,Bearish,nan $TSLA sweep buyers exhausted. Either going lower or range bound. Still watching,nan TSLA sweep buyers exhausted. Either going lower or range bound. Still watching,nan tsla sweep buyers exhausted either going lower range bound still watching,12
stocktwits,TSLA,654504617,1779894545.0,2026-05-27T15:09:05Z,,"$MCOM 
I never I would see $4.20 a share $TSLA 
😭 $SPY august im getting paid out finally",,,https://stocktwits.com/PivotalSaints/message/654504617,https://stocktwits.com/PivotalSaints/message/654504617,Bullish,"nan $MCOM 
I never I would see $4.20 a share $TSLA 
😭 $SPY august im getting paid out finally",nan MCOM I never I would see 4.20 a share TSLA SPY august im getting paid out finally,nan mcom never see share tsla spy august getting paid finally,11
stocktwits,TSLA,654504565,1779894528.0,2026-05-27T15:08:48Z,,"$TSLA        either a pause, or breakdown coming; Nvda trying to take down the market smh",,,https://stocktwits.com/Jeffrice737/message/654504565,https://stocktwits.com/Jeffrice737/message/654504565,Bullish,"nan $TSLA        either a pause, or breakdown coming; Nvda trying to take down the market smh","nan TSLA either a pause, or breakdown coming Nvda trying to take down the market smh",nan tsla either pause breakdown coming nvda trying take down market smh,12
stocktwits,TSLA,654504532,1779894519.0,2026-05-27T15:08:39Z,,$TSLA thinkingn of selling AI stocks and moving all to tesla.,,,https://stocktwits.com/AcneBoy/message/654504532,https://stocktwits.com/AcneBoy/message/654504532,,nan $TSLA thinkingn of selling AI stocks and moving all to tesla.,nan TSLA thinkingn of selling AI stocks and moving all to tesla.,nan tsla thinkingn selling stocks moving tesla,7
stocktwits,TSLA,654504155,1779894382.0,2026-05-27T15:06:22Z,,$TSLA qqq breaking down. No more fuel. Down we go,,,https://stocktwits.com/Grkgy88/message/654504155,https://stocktwits.com/Grkgy88/message/654504155,,nan $TSLA qqq breaking down. No more fuel. Down we go,nan TSLA qqq breaking down. No more fuel. Down we go,nan tsla qqq breaking down fuel down,7
stocktwits,TSLA,654504130,1779894376.0,2026-05-27T15:06:16Z,,"$TSLA $SPCX  
Complete fantasy valuation at even $1.25 trillion for another money-burning Elon Fantasy Business™.",,,https://stocktwits.com/trumpdisasterprez/message/654504130,https://stocktwits.com/trumpdisasterprez/message/654504130,,"nan $TSLA $SPCX  
Complete fantasy valuation at even $1.25 trillion for another money-burning Elon Fantasy Business™.",nan TSLA SPCX Complete fantasy valuation at even 1.25 trillion for another money-burning Elon Fantasy Business .,nan tsla spcx complete fantasy valuation even trillion another money burning elon fantasy business,14
stocktwits,TSLA,654503782,1779894268.0,2026-05-27T15:04:28Z,,$TSLA lol everytime it tries to drop you literally see a $1 pump save. Just buy calls this stock is so manipulated you know it&#39;s only going up,,,https://stocktwits.com/Moneyboss3/message/654503782,https://stocktwits.com/Moneyboss3/message/654503782,Bullish,nan $TSLA lol everytime it tries to drop you literally see a $1 pump save. Just buy calls this stock is so manipulated you know it&#39;s only going up,nan TSLA lol everytime it tries to drop you literally see a 1 pump save. Just buy calls this stock is so manipulated you know it 39 s only going up,nan tsla lol everytime tries drop literally see pump save buy calls stock manipulated know only going,17
stocktwits,TSLA,654503777,1779894265.0,2026-05-27T15:04:25Z,,"$TSLA  
 
Awesome trade 
 
All out here on that pullback 
 
Easiest 50% you can make",,1.0,https://stocktwits.com/Steve_TheBull_Rogers/message/654503777,https://stocktwits.com/Steve_TheBull_Rogers/message/654503777,,"nan $TSLA  
 
Awesome trade 
 
All out here on that pullback 
 
Easiest 50% you can make",nan TSLA Awesome trade All out here on that pullback Easiest 50 you can make,nan tsla awesome trade here pullback easiest make,8
stocktwits,TSLA,654503750,1779894254.0,2026-05-27T15:04:14Z,,$AMD $AAPL $TSLA $NVDA $META Nothing new for  people who trading stocks/futures/options : &quot; Past performance is not necessarily indicative of future results.”,,1.0,https://stocktwits.com/RoniToni/message/654503750,https://stocktwits.com/RoniToni/message/654503750,,nan $AMD $AAPL $TSLA $NVDA $META Nothing new for  people who trading stocks/futures/options : &quot; Past performance is not necessarily indicative of future results.”,nan AMD AAPL TSLA NVDA META Nothing new for people who trading stocks futures options quot Past performance is not necessarily indicative of future results.,nan amd aapl tsla nvda meta nothing new people trading stocks futures options quot past performance necessarily indicative future results,20
stocktwits,TSLA,654503730,1779894248.0,2026-05-27T15:04:08Z,,"$TSLA Their Sales numbers are Garbage 
Cars are nothing special 
People probably look up Crypto investments &amp; companies ownership in different fields when they buy 
Bubblecoin heading to $50,000 fast wont be Good for this, Trading @ 1000x Earnings",,,https://stocktwits.com/1Empire007/message/654503730,https://stocktwits.com/1Empire007/message/654503730,Bullish,"nan $TSLA Their Sales numbers are Garbage 
Cars are nothing special 
People probably look up Crypto investments &amp; companies ownership in different fields when they buy 
Bubblecoin heading to $50,000 fast wont be Good for this, Trading @ 1000x Earnings","nan TSLA Their Sales numbers are Garbage Cars are nothing special People probably look up Crypto investments amp companies ownership in different fields when they buy Bubblecoin heading to 50,000 fast wont be Good for this, Trading 1000x Earnings",nan tsla sales numbers garbage cars nothing special people probably look crypto investments amp companies ownership different fields buy bubblecoin heading fast wont good trading earnings,26
