source,subreddit_or_ticker,post_id,created_utc,created_datetime,title,text,score_or_likes,num_comments,url,permalink,stocktwits_sentiment_label,combined_text,clean_text,lda_text,token_count,emotion_admiration,emotion_amusement,emotion_anger,emotion_annoyance,emotion_approval,emotion_caring,emotion_confusion,emotion_curiosity,emotion_desire,emotion_disappointment,emotion_disapproval,emotion_disgust,emotion_embarrassment,emotion_excitement,emotion_fear,emotion_gratitude,emotion_grief,emotion_joy,emotion_love,emotion_nervousness,emotion_neutral,emotion_optimism,emotion_pride,emotion_realization,emotion_relief,emotion_remorse,emotion_sadness,emotion_surprise
stocktwits,TSLA,654503777,1779894265.0,2026-05-27T15:04:25Z,,"$TSLA  
 
Awesome trade 
 
All out here on that pullback 
 
Easiest 50% you can make",,1.0,https://stocktwits.com/Steve_TheBull_Rogers/message/654503777,https://stocktwits.com/Steve_TheBull_Rogers/message/654503777,,"nan $TSLA  
 
Awesome trade 
 
All out here on that pullback 
 
Easiest 50% you can make",nan TSLA Awesome trade All out here on that pullback Easiest 50 you can make,nan tsla awesome trade here pullback easiest make,8,0.9540806412696838,0.0003945189237128943,0.00013394953566603363,0.0004925559624098241,0.016315313056111336,0.00015217778855003417,0.000258858926827088,0.0004545577394310385,0.00010930734424619004,0.0002535267558414489,0.00039194204146042466,8.551905921194702e-05,2.8097438189433888e-05,0.001046675373800099,4.20406176999677e-05,0.0004784045449923724,2.528623372199945e-05,0.0006332813063636422,0.00026014907052740455,1.4317398381535895e-05,0.02190309204161167,0.0008949283510446548,0.00030751695157960057,0.0008366084075532854,6.881211447762325e-05,2.1185669538681395e-05,8.489596075378358e-05,0.00023185760073829442
stocktwits,TSLA,654503750,1779894254.0,2026-05-27T15:04:14Z,,$AMD $AAPL $TSLA $NVDA $META Nothing new for  people who trading stocks/futures/options : &quot; Past performance is not necessarily indicative of future results.”,,1.0,https://stocktwits.com/RoniToni/message/654503750,https://stocktwits.com/RoniToni/message/654503750,,nan $AMD $AAPL $TSLA $NVDA $META Nothing new for  people who trading stocks/futures/options : &quot; Past performance is not necessarily indicative of future results.”,nan AMD AAPL TSLA NVDA META Nothing new for people who trading stocks futures options quot Past performance is not necessarily indicative of future results.,nan amd aapl tsla nvda meta nothing new people trading stocks futures options quot past performance necessarily indicative future results,20,0.00011595006799325347,8.35477258078754e-05,0.00011518716928549111,0.000792846956755966,0.0027161561883985996,8.967534813564271e-05,0.00038529204903170466,7.148805889301002e-05,5.3486150136450306e-05,0.0004744395846500993,0.005106127820909023,8.370435534743592e-05,3.934707274311222e-05,4.7813442506594583e-05,5.542057624552399e-05,5.383408279158175e-05,2.0589071937138215e-05,7.257048855535686e-05,4.723270103568211e-05,2.3411201254930347e-05,0.9876093864440918,0.0002737836621236056,1.6979611245915294e-05,0.0014355728635564446,3.469646253506653e-05,2.267767376906704e-05,0.00010920219938270748,4.959621946909465e-05
stocktwits,TSLA,654503730,1779894248.0,2026-05-27T15:04:08Z,,"$TSLA Their Sales numbers are Garbage 
Cars are nothing special 
People probably look up Crypto investments &amp; companies ownership in different fields when they buy 
Bubblecoin heading to $50,000 fast wont be Good for this, Trading @ 1000x Earnings",,,https://stocktwits.com/1Empire007/message/654503730,https://stocktwits.com/1Empire007/message/654503730,Bullish,"nan $TSLA Their Sales numbers are Garbage 
Cars are nothing special 
People probably look up Crypto investments &amp; companies ownership in different fields when they buy 
Bubblecoin heading to $50,000 fast wont be Good for this, Trading @ 1000x Earnings","nan TSLA Their Sales numbers are Garbage Cars are nothing special People probably look up Crypto investments amp companies ownership in different fields when they buy Bubblecoin heading to 50,000 fast wont be Good for this, Trading 1000x Earnings",nan tsla sales numbers garbage cars nothing special people probably look crypto investments amp companies ownership different fields buy bubblecoin heading fast wont good trading earnings,26,0.0005237364093773067,0.0006998192402534187,0.0025183921679854393,0.03324291110038757,0.005965924821794033,0.00034012479591183364,0.000837631116155535,0.0002134835085598752,0.0002718211617320776,0.008169237524271011,0.13696616888046265,0.0020872908644378185,0.00044992100447416306,0.00015931762754917145,0.00020780817430932075,0.00014591196668334305,8.604225877206773e-05,0.00020489725284278393,0.000181575829628855,0.00010538127389736474,0.8001106381416321,0.0008028530864976346,6.876537372590974e-05,0.004372869618237019,0.00010993130126735196,0.00011764340160880238,0.0008162419544532895,0.00022369317593984306
